{
 "version": "1.0",
 "assets": [
  {
   "id": "etf-series",
   "type": "diagram",
   "path": "projects/etf-100k-four-fund-race/public/etf-100k-four-fund-race/data/etf-series.json",
   "source_tool": "build_data.py",
   "scene_id": "sc04",
   "subtype": "canonical_account_value_series",
   "format": "json",
   "provider": "local",
   "license": "derived_from_user_supplied_workbook",
   "cost_usd": 0.0,
   "generation_summary": "四只ETF 1510 个交易日的账户资产序列（归一化到 ￥100,000 起点），附最大回撤、回撤跨度、最长未创新高区间、年末截面与七个注解节点。由用户工作簿导出并与工作簿「汇总」表逐项对账后才允许下游运行。"
  },
  {
   "id": "onscreen-deck",
   "type": "diagram",
   "path": "projects/etf-100k-four-fund-race/artifacts/onscreen.json",
   "source_tool": "build_script.py",
   "scene_id": "sc01",
   "subtype": "on_screen_copy_and_number_deck",
   "format": "json",
   "provider": "local",
   "license": "project_internal",
   "cost_usd": 0.0,
   "generation_summary": "本片十场画面的文案与数值台本。所有数值由 build_script.py 的数据辅助函数生成，verify() 会在写入前把 51 处屏幕数字逐一回查序列；手写文案里不含任何需被读准的数字。"
  }
 ],
 "total_cost_usd": 0.0,
 "metadata": {
  "content_category": "finance",
  "composition_only": true,
  "narration_omitted": true,
  "narration_omitted_reason": "用户显式选择全程无口播（decision d-008）。本阶段不调用 tts_selector。",
  "music_omitted": true,
  "music_omitted_reason": "持久无BGM默认 + 用户选择完全静音（decision d-009）。本文件不含 music 资产。",
  "footage_omitted": true,
  "footage_omitted_reason": "语义动效审计结论：15/15 个 beat 为 precision-critical，0 个语义动态候选（decision d-007）。不调用 video_selector / image_selector。",
  "audio_assets": 0,
  "required_tools_note": "finance-dossier 清单把 tts_selector 列为 assets 阶段的 required_tool。本片因用户显式选择无口播而不使用它——这是已批准的 deviation，依据是 decision d-008 与用户开工前的四项设定，不是遗漏。",
  "requirement_type_map": {
   "data": "diagram",
   "copy_deck": "diagram",
   "note": "scene_plan.required_assets[].type 用 data / copy_deck 描述需求；asset_manifest 的 type 枚举没有对应取值，故两者都落在 diagram（图表数据类）。"
  },
  "scene_coverage": {
   "scenes_requiring_etf-dataset": [
    "sc04",
    "sc05",
    "sc08",
    "sc09"
   ],
   "scenes_requiring_onscreen-deck": [
    "sc01",
    "sc02",
    "sc03",
    "sc06",
    "sc07",
    "sc10"
   ]
  },
  "filmstrip_substitute": {
   "path": "projects/etf-100k-four-fund-race/assets/qa/data_proof.png",
   "why": "本片没有图像素材可做剧照条。资产复核对象是数字本身，因此用数据核对表代替剧照条：四条曲线 + 全量指标 + 对账说明，供逐项核对后再进入编写。"
  },
  "review_evidence": {
   "workbook_reconciliation": {
    "raw_observations_checked": 6039,
    "raw_window": "2020-07-03..2026-09-18",
    "source_files": 28
   },
   "account_formula": "账户资产_t = 100000 × 后复权收盘价_t ÷ 后复权收盘价_起点",
   "dividend_treatment": "后复权口径，现金分红按再投资处理",
   "missing_record": "512890 在 2021-10-22 缺 1 条成交记录，按用户工作簿口径沿用前一交易日账户资产。",
   "caveat": "后复权因子由行情源提供；不同供应商可能因复权算法与精度产生轻微差异。"
  },
  "race_scene_note": "竖屏安全区：可读文字限定在 y ≤ 1400、x ∈ [96, 984]。本场为连续镜头，七个注解拍（2020 下半年 → 2021-02 见顶、2021 分化 → 排名变化、2022 跌破起跑线、2023 深水区、2024-02 极值（全屏标注）、2024 收官 → 2025-11 双雄见顶、收束到区间终点）叠在同一镜头之上，不产生剪辑点。"
 }
}